{
  "domain": "前列腺癌流行病学",
  "version": "1.0.0",
  "description": "前列腺癌流行病学数据知识三元组",
  "triplets": [
    {
      "head": "前列腺癌",
      "relation": "2022年中国新发病例数",
      "tail": "13.42万例",
      "source": "GLOBOCAN 2022 / 国家癌症中心",
      "evidence": "2022年中国前列腺癌新发病例约13.42万，占男性恶性肿瘤发病第6位",
      "domain": "流行病学",
      "confidence": 0.95,
      "pmid": "38433564"
    },
    {
      "head": "前列腺癌",
      "relation": "2022年中国死亡人数",
      "tail": "约5万例",
      "source": "GLOBOCAN 2022 / 国家癌症中心",
      "evidence": "2022年中国前列腺癌死亡约5万例，病死比约37%",
      "domain": "流行病学",
      "confidence": 0.95,
      "pmid": "38433564"
    },
    {
      "head": "前列腺癌",
      "relation": "病死比",
      "tail": "约37%",
      "source": "GLOBOCAN 2022",
      "evidence": "前列腺癌病死比约37%，低于肺癌、肝癌等，但晚期预后仍较差",
      "domain": "流行病学",
      "confidence": 0.90
    },
    {
      "head": "前列腺癌",
      "relation": "中国男性恶性肿瘤发病率排名",
      "tail": "第6位",
      "source": "国家癌症中心2022年数据",
      "evidence": "前列腺癌居中国男性恶性肿瘤发病第6位，位于肺癌、结直肠癌、胃癌、肝癌、食管癌之后",
      "domain": "流行病学",
      "confidence": 0.95
    },
    {
      "head": "前列腺癌发病率",
      "relation": "变化趋势",
      "tail": "持续上升",
      "source": "国家癌症中心统计年报",
      "evidence": "受老龄化和PSA筛查普及双重影响，中国前列腺癌发病率近年来持续上升，年均增速约8%",
      "domain": "流行病学",
      "confidence": 0.92
    },
    {
      "head": "前列腺癌发病率上升",
      "relation": "驱动因素",
      "tail": "人口老龄化",
      "source": "流行病学研究综述",
      "evidence": "中国人口老龄化加剧，前列腺癌发病高峰在65-75岁，老龄人口增加直接推动发病人数上升",
      "domain": "流行病学",
      "confidence": 0.93
    },
    {
      "head": "前列腺癌发病率上升",
      "relation": "驱动因素",
      "tail": "PSA筛查普及",
      "source": "中国泌尿外科临床实践",
      "evidence": "PSA筛查在体检中逐步普及，增加了早期病例检出率，导致统计发病率上升",
      "domain": "流行病学",
      "confidence": 0.90
    },
    {
      "head": "前列腺癌",
      "relation": "高发年龄",
      "tail": "65-75岁",
      "source": "SEER数据库 / 中国癌症统计",
      "evidence": "前列腺癌发病中位年龄约68岁，65岁以上男性占所有病例的60%以上",
      "domain": "流行病学",
      "confidence": 0.95
    },
    {
      "head": "前列腺癌",
      "relation": "全球发病率排名",
      "tail": "男性恶性肿瘤第2位",
      "source": "GLOBOCAN 2022",
      "evidence": "全球范围内前列腺癌是男性第二大常见恶性肿瘤，仅次于肺癌",
      "domain": "流行病学",
      "confidence": 0.95,
      "pmid": "38433564"
    },
    {
      "head": "中国前列腺癌",
      "relation": "诊断特征",
      "tail": "晚期比例偏高",
      "source": "中国前列腺癌诊疗现状研究",
      "evidence": "中国前列腺癌初诊时晚期（III-IV期）比例超过50%，远高于欧美国家的15-20%，主要由于缺乏系统筛查",
      "domain": "流行病学",
      "confidence": 0.88
    },
    {
      "head": "中国前列腺癌",
      "relation": "5年生存率",
      "tail": "约66.7%",
      "source": "国家癌症中心",
      "evidence": "中国前列腺癌5年相对生存率约66.7%，低于美国的97%以上，与早诊率偏低有关",
      "domain": "流行病学",
      "confidence": 0.90
    },
    {
      "head": "前列腺癌",
      "relation": "危险因素",
      "tail": "家族史",
      "source": "遗传流行病学研究",
      "evidence": "有前列腺癌家族史的男性发病风险增加2-3倍，BRCA2突变携带者风险更高",
      "domain": "流行病学",
      "confidence": 0.93
    }
  ]
}
